中新社台北九月二日电 (记者陈立宇 曾福志)据台湾“经济部”能源局二日公布的最新数字，截至二00八年七月底，台湾风力发电累计装置容量为三十四点七万千瓦，年发电量约九点三六亿度，可供二十三万四千户平均每户用电四千度的家庭用电，能源贡献度为二十三点二万公秉油当量、可有效减少五十五点六万公吨的二氧化碳。,340415," (11,台湾)"
台特侦组因陈水扁背部不适提前结束传讯,340416,
中新网9月3日电 涉及洗钱弊案的陈水扁3日上午9点半准时抵达特侦组接受传讯，并于下午2点05分步出特侦组，结束今天的传讯。特侦组发言人陈云南表示，特侦组原本希望能够继续侦讯陈水扁，但因为陈水扁的背部不适而提前结束，有必要将再次传讯。,340416,
国家发改委协调四省电煤供应,340417,
本报讯 记者黄继妍报道：9月2日，国家发改委在南昌召开四省电煤供应保障协调会，对江西、湖北、湖南、安徽四省电煤调运供应进行重点协调。国家发改委副主任刘铁男、副省长洪礼和出席会议。,340417," (11,南昌) (21,江西) (23,湖北) (25,湖南) (27,安徽)"
国民党团拟提案冻结陈水扁部分卸任礼遇,340418,
中新网9月3日电 国民党中央政策会执行长林益世表示，基于社会观感与社会公义，陈水扁家庭涉嫌洗钱等弊案，司法已在调查，国民党团将在台“立法院”开议后，审查明年总预算案时提案冻结部分陈水扁卸任礼遇，待全案真相大白后始得动支。,340418,
国际残奥委主席补习中文 称开幕式值得期待,340419,
中新社北京九月二日电 题：“我在为残奥会开幕式补习中文”――访国际残奥委主席菲利普・克雷文,340419,
德国总统克勒将出席残奥会开幕式,340420," (0,德国)"
中新网9月3日电 综合报道，德国总统办公室消息，德国总统克勒将出席9月6日北京残奥会的开幕式。克勒的亚洲行2日开始，他还将访问哈萨克斯坦和蒙古。,340420," (7,德国) (26,亚洲) (36,哈萨克斯坦) (38,蒙古)"
我国首个环境监测预报卫星本周有望升空,340421,
我国计划建造最终由8颗卫星组成的环境与灾害监测预报小卫星星座,340421,
药监局分离药品受理审评审批三项职能,340422,
新华网北京9月3日电（记者刘奕湛）国家食品药品监督管理局新闻发言人颜江瑛3日在回答记者提问时表示，药监局对药品的受理、审评、审批三项职能的权力进行了分离，三个职能不会集中在一个部门。,340422,
药监局将增加食品卫生安全监管职责,340423,
中新社北京九月三日电 (记者 曾利明)国家食品药品监督管理局新闻发言人颜江瑛今天宣布：经国务院批准，该局将综合协调食品安全、组织查处食品安全重大事故职责划给国家卫生部；同时把卫生部负责的食品卫生许可，餐饮业等消费环节食品安全监管、保健食品、化妆品卫生监督管理的职责划入该局；目前交接工作已经开始。,340423,
质检总局被指通过监管码获利续企业律师遭约见,340424,
本报讯 (记者胡笑红)在两次约见防伪企业希望对方撤诉的要求遭拒后，国家质检总局昨天又开始约见防伪企业代理律师周泽。,340424,
陈水扁再度召开记者会就机要费案进行辩解,340425,
中新网9月3日电 身陷机要费与洗钱案风暴的陈水扁，今天上午再度被传讯后，下午随即召开记者会，强调称机要费是特别费的一种，并质疑马英九虽然特别费被起诉但仍脱身，因此对外“喊冤”。,340425,
陈水扁可能遭检察官申请羁押,340426,
中新网9月3日电 涉及洗钱弊案的陈水扁今天(3日)被特侦组传讯，虽然他在重重警力戒护下，一派轻松走进特侦组，因为检方怀疑陈水扁和叶盛茂与陈镇慧之间有串证之虞，不排除在今天侦讯完后，要声请羁押陈水扁。,340426,
陈水扁应讯结束迅速离开台特侦组,340427,
人民网快讯 今日午后约2时，陈水扁第3度“机要费”案应讯结束，过程长达4个小时，在律师及随扈陪同下，迅速离开特侦组，并未对外发表言论，直接驱车返回办公室。,340427,
香港12所高校录取1400名内地新生,340428," (0,香港)"
新华网香港9月2日电 (记者 吕诺) 被香港12所高校录取的约1400名内地新生近日陆续到校报到。各高校积极帮助内地新生适应崭新的学习生活，还为来自四川地震灾区的学生提供不同额度的奖学金，让他们安心完成学业。,340428,
香港选委会称投票结束前不可公布调查结果,340429,
中新网9月3日电 据香港特区政府网站消息，香港选举管理委员会劝吁传媒及其它机构，在投票结束前，不可公布票站调查结果，或具体评论、预测个别候选人或地方选区候选人名单的表现，以免影响选民的投票意向和选举结果。,340429," (5,香港)"
马英九称将会要求大陆签署和平协议,340430,
中新网9月3日电 马英九日前接受媒体专访时称，台当局要建立一个“小而美”的台军，这方面要维持防务预算不少于GDP百分之三，“但我们不会采取攻势的作为，战略上一定是采取守势。”,340430,
中国向索马里提供100万美元无偿援助,340431," (0,中国) (2,索马里)"
新华网内罗毕9月4日电(记者 赵卓昀)中国驻肯尼亚大使馆4日在内罗毕向索马里驻肯使馆移交了中国政府提供的100万美元无偿援助款以及一台发电机。,340431," (1,内罗毕) (9,中国) (11,肯尼亚) (18,索马里)"
中国工程院院长称正酝酿院士交费制,340432,
中新网9月4日电 中国工程院院长徐匡迪日前在接受凤凰卫视女主播吴小莉主持的《问答神州》节目专访时透露，正在酝酿院士交费，可能某个时期随着待遇提高也要交点费。,340432,
全国8月发生交通事故21150起5660人死亡,340433,
中新网9月4日电 据中国公安部网站消息，8月份，全国共发生道路交通事故21150起，造成5660人死亡、25418人受伤，直接财产损失0.83亿元。分别比去年同期下降24.4%、19.8%、24.7%和25.6%。发生一次死亡10人以上特大道路交通事故4起，同比增加1起。,340433,
卫生部查处32种不合格化妆品(附名单),340434,
中新网9月4日电 据卫生部网站消息，卫生部近日查处3种甲醇含量超标的发胶类化妆品、15种汞含量超标的宣称有祛斑或美白功能化妆品和14种产品标签标识说明书不合格的化妆品。,340434,
外交部及中国驻外使领馆收到19.19亿地震捐款,340435,
新华网北京9月4日电 四川汶川特大地震发生以来，国际社会向中国政府和人民表达真诚同情和慰问，并提供了各种形式的支持和援助。据外交部消息，截至8月27日，外交部及中国驻外使领馆、团共收到外国政府、团体和个人等捐资19.19亿元人民币。,340435,
外交部提醒中国公民谨慎前往巴基斯坦,340436," (6,巴基斯坦)"
中新网9月4日电 据外交部网站消息，近期，巴基斯坦安全形势较紧张，个别地区治安状况较差，不断发生涉外国公民的恶性案件。,340436," (11,巴基斯坦)"
我国建立105个避孕药具不良反应监测试点网,340437,
中新社北京九月四日电 (记者 曾利明) 记者今天从国家人口和计划生育委员会获悉：一个由一百零五个县级监测哨点组成，覆盖全国三十一个省、区、市的避孕药具不良反应监测试点网已经建立。通过该网络可监测避孕药具安全性和有效性，为育龄人群提供避孕方法知情选择，提高生殖健康水平提供技术保证。,340437,
我国目前正逐步形成大扶贫格局,340438,
新华网南昌9月4日电（记者郑悦）国务院扶贫办副主任王国良近日表示，我国目前已逐步形成了一个集行业政策、区域政策和社会政策于一体的“大扶贫”格局，加快了扶贫进程。,340438,
收费公路权益转让办法出台 累计收费禁超25年,340439,
本报讯(记者郭鲲)昨天，交通运输部联合国家发改委、财政部共同颁布《收费公路权益转让办法》。针对近年来一些地方出现的违规多次转让收费公路收费权，《办法》首次明确规定，一条收费公路的收费时间如果已经超过收费期限2/3，就不得转让其收费权，而经营性收费公路转让收费权后，累计收费期限不能超过25年。,340439,
教育部明确规定学生睡眠用眼时间,340440,
新华网北京9月4日电 (记者 刘奕湛、吴晶)教育部4日印发的《中小学学生近视眼防控工作方案》对中小学生的睡眠时间、用眼时间以及作业时间都作出明确规定，希望借此遏制青少年近视眼率居高不下的趋势。,340440,
海基会两岸共同打击犯罪将列入下一步两会协商,340441,
中新社台北九月四日电(记者 陈立宇 曾福志)台湾海峡交流基金会副董事长兼秘书长高孔廉四日在记者会上表示，两岸共同打击犯罪将列入第二次江、陈会协商内容，以建立两岸共同打击犯罪模式，海基会希望能尽速达成协议。,340441,
煤监局副局长赶赴辽宁阜新矿难事故现场,340442," (3,辽宁)"
新华网北京9月4日电(记者 杜宇)记者4日从国家安全监管总局获悉，辽宁阜新市清河区河西镇八矿井下发生瓦斯事故后，安全监管总局已派国家煤矿安监局副局长付建华和国家安全生产应急救援指挥中心人员赶赴事故现场，协助指导事故抢险救援等工作。,340442,
美国司法安全部门协查陈水扁家族在美资产,340443,
中新网9月4日电 针对陈水扁之子陈致中是否在美国弗吉尼亚大学附近购买住宅及其资金来源流向，台湾法务部门已经洽请美国司法部等部门协助调查，美国司法部除了本身的联邦调查局等单位外，也转请国土安全部协助。,340443,
金门海滩发现大批未爆炸弹 台军方将移除销毁,340444,
中新网9月4日电 金门南海岸尚义机场外海滩，今天发现有三十多颗未爆弹，台军人员到现场鉴定不具危险性，将予以移除销毁。,340444,
陈水扁洗钱范围横跨五大洲 总额逾10亿新台币,340445,
中新网9月4日电 扁家海外账户越扯越大，洗钱范围横跨五大洲13地，特侦组加紧脚步追查又有新发现，除了陈水扁儿媳妇黄睿靓在开曼岛美林银行户头的2100万美金之外，陈水扁夫人吴淑珍胞兄吴景茂在4年前也从泽西岛汇了1500万美金到模里西斯开设控股公司，光是这两笔汇款总额就高达新台币10亿元以上。,340445,
韩国要求台湾媒体取消南韩称呼,340446," (0,韩国) (2,台湾)"
中新网9月4日电 据台湾《联合报》报道，继要求媒体报导韩国新闻必须详加查证后，韩国驻台北代表部又有新招！上周韩国驻台北代表部主动发函台湾各大媒体要求正名，希望台湾媒体在处理韩国新闻时，以“韩国”取代“南韩”，以正视听。,340446,
香港今年68人服用壮阳药感到不适3人死亡,340447," (0,香港)"
中新网9月4日电 据香港明报报道，香港元朗一名中年男子3日凌晨怀疑服食壮阳药后，感到呕吐头晕，女友人代为报警，事主送院治理后无碍。,340447,
马英九呼吁陈水扁勇于面对司法,340448,
中新网9月4日电 陈水扁3日就机要费案召开记者会，大谈马英九担任市长时的特别费。马英九对此全程掌握，随即由发言人出面说明，要陈水扁勇于面对司法，不要旁生枝节。,340448,
马英九幕僚称两岸须先搁置争议 促进共识,340449,
中新网9月4日电 据台湾TVBS报道，马英九办公室今天表示，马英九与两岸有关的政见可以顺利完成，就是在于“搁置争议”。,340449,
假日办：国庆提前放假让工作休息时间更平均,340450,
国庆长假提前至9月29日，这一变化让一些市民感到不适应。那么今年的“十一”长假为什么要提前呢？时报记者昨日电话连线国家假日办有关负责人，该负责人表示，此举是为了让国家法定假日更显人性化，让“十一”前后周的工作与休息时间更为“平均”。,340450,
卫生部通报四家医院违反规定配置射波刀,340451,
中新网9月5日电 据卫生部网站消息，卫生部今日将天津市肿瘤医院、广西中医学院附属瑞康医院、复旦大学附属华山医院和山东鲁台医院装备使用射波刀违规情况通报如下：,340451,
港珠澳大桥总体方案结束模型试验评标,340452,
中新网9月5日电 据香港大公报报道，备受关注的港珠澳大桥又传佳音。记者4日从广东省交通厅获悉，大桥总体方案深化研究及工程物理模型试验评标工作结束，由中交公路规划设计院有限公司主办的四家单位联合体，以评标委员会推荐的候选人中标。,340452,
澳门16人食用生蚝后出现不适,340453," (0,澳门)"
中新网9月5日电 据新华澳报报道，继3日澳门卫生局公布有14名港澳人士在澳门酒店食用自助餐后出现不适，卫生局4日再接获报告，有16名澳门人在酒店食用自助餐出现不适。,340453,
知情人士称农民工养老保险办法年内出台,340454,
知情人士称，根据农民工流动性强和收入低的两大特点，将为农民工建立个人大账户，将其个人缴费和单位全部或绝大部分的缴费，都纳入这个账户，该账户可随农民工流动而在全国流动。,340454,
陈水扁结束应讯称检方要求侦讯内容保密,340455,
中新网9月5日电 陈水扁今天(5日)上午以证人身份到台北地检署应讯，经过短短1个多小时的侦讯后离开。陈水扁在北检门口向媒体表示，今天检察官有特别交代，所有的侦讯内容都列为机密，也要求今天所有在场的当事人、证人、律师都不得公开。,340455,
香港又有女童感染神秘病毒死亡成1个月内第4宗,340456," (0,香港)"
中新网9月5日电 据星岛日报报道，开学仅3天，香港再有女童被神秘病毒袭击夺命，是一个月内第4宗死亡个案。香港卫生防护中心4日公布，一名上月曾到访广东的6岁女童，开学不久因发烧、喉咙痛及呕吐到东区医院求诊，被诊断为上呼吸道感染，但取药离院后翌日即告病逝，中心正调查女童是否因传染病致死。,340456," (13,香港) (47,广东)"
香港将向55万学生发放共5.5亿港元津贴,340457," (0,香港)"
新华网香港9月5日电(记者 孙浩)香港特区政府5日宣布，将从10月起向所有在2008至2009学年已申请资助并符合资格的学生，发放一次性1000港元现金津贴，共涉资约5.5亿港元，约55万名学生受惠。,340457," (1,香港)"
香港残奥村两住客感染诺如病毒,340458," (0,香港)"
中新网9月5日电 据香港大公报报道，香港残奥村三名女住客出现屙呕病征，其中两人证实感染诺如病毒，分别入住韦尔斯医院和玛嘉烈医院接受治疗，现时情况稳定。卫生署卫生防护中心人员已到访残奥村，酒店也已根据卫生防护中心建议进行消毒。,340458," (5,香港)"
20位贵宾和50位体育部长将出席残奥开幕式,340459,
中新网9月6日电 在今天上午举行的北京奥组委和国际残奥委会举行的联合例行新闻发布会上，北京奥组委执行副主席兼秘书长王伟透露：大概有20位贵宾和50位体育部长将会出席北京残奥会开幕式。,340459," (45,北京)"
伊朗总统抵京出席北京残奥会开幕式,340460,
国际在线消息(记者蔡靖?)：6日上午，伊朗总统艾哈迈迪内贾德乘专机抵达北京首都国际机场，他将出席当晚举行的北京残奥会开幕式。,340460,
体育总局局长称将坚持举国体制 反驳劳民伤财说,340461,
举国体制是许多国家在一些重要工作、重大工程中普遍采取的一种行之有效、效率极高的办法,340461,
公安部授予援川沈阳特警集体一等功,340462,
晨报讯(记者 冯翔) 千里迢迢奔赴灾区，抓逃犯、搭帐篷、发现金、疏导交通……他们，黑了瘦了。,340462,
农业部：局部可能发生重大动物疫情,340463,
据新华社电 当前正值禽流感等重大动物疫病高发季节，农业部副部长高鸿宾5日要求，各级畜牧兽医部门切实采取有效措施，做好秋季重大动物疫病防控工作，力争不发生高致病性禽流感等重大动物疫情。,340463,
北京残奥会今晚8点开幕,340464,
中新网9月6日电 残疾人的体育盛会北京残奥会将于当地时间6日晚8点在“鸟巢”隆重开幕，以此展开为期12天的激烈争夺。共同社消息，在开幕式上，担任日本代表团旗手的是田径选手铃木彻。,340464,
北京残奥火炬接力结束 今晚点燃主火炬,340465," (0,北京)"
中新网9月6日电 今天上午10时37分左右，随着最后一棒火炬手、原中国残联理事兼宣文部主任赵济华手持祥云火炬点燃圣火盆，北京残奥会圣火朝阳公园传递落下帷幕。之后，圣火护卫直接将火种送至国家体育场鸟巢，待开幕式时适时点燃残奥主火炬。,340465,
台前调查局长与陈水扁当庭对质(组图),340466,
中新网9月6日电 台湾当局前“调查局长”叶盛茂涉嫌隐匿陈水扁家庭海外洗钱公文案，台北检方五日上午先后传讯叶盛茂、陈水扁，并让两人当庭对质。两人依然对叶盛茂是否有交付给陈水扁有关扁家海外洗钱案情资公文各说各话。,340466,
台北大学制定杰出校友除名规定针对吴淑珍,340467,
台海网9月6日讯 陈水扁家庭岛外洗钱疑案，影响到台湾高等教育界。继台湾大学校长李嗣涔为陈水扁父子涉及洗钱案道歉后，台北大学更首开岛内大学先例，增订“杰出校友除名”规定。陈水扁夫人吴淑珍、原陈水扁当局“调查局长”叶盛茂都曾获台北大学的杰出校友称号，如今他们涉及重大司法案件，校方和校友总会开会决议，明订如果法院判决有重大违法行为、影响校誉，经“杰出校友遴选委员会”同意之后，将予以除名。,340467," (13,台湾)"
台湾将大陆游客赴台时限延长至15天,340468," (0,台湾)"
台海网9月6日讯 台湾“行政院”“陆委会”昨日邀集旅行业者先行沟通，决议将大陆游客团赴台10天上限延长为15天，以及开放两岸同步申办大陆游客赴台证件。,340468,
回良玉致信祝贺环境灾害卫星A、B发射成功,340469,
新华网北京9月6日电 2008年9月6日11时25分，我国在太原卫星发射中心用“长征二号丙”运载火箭，成功将环境与灾害监测预报小卫星星座A、B星送入太空，约51分钟后，卫星准确进入轨道。中共中央政治局委员、国务院副总理、国家减灾委员会主任回良玉致信祝贺，向各参研、参试单位和广大科技工作者、干部职工表示衷心的感谢和崇高的敬意。,340469,
我国一箭双星成功发射环境减灾A、B卫星(图),340470,
中新网太原9月6日电 (记者 孙自法) 北京时间六日上午十一时二十五分，中国在太原卫星发射中心用“长征二号丙”运载火箭，以一箭双星方式将“环境与灾害监测预报小卫星”(简称“环境减灾”)A、B卫星成功送入太空。,340470,
李源潮：干部要敬畏历史敬畏百姓敬畏人生,340471,
新华网延安9月5日电 9月5日，中国浦东、井冈山、延安干部学院举行2008年秋季开学典礼，中央组织部部长李源潮在讲话中说，当干部要有敬畏之心，一要敬畏历史，使自己的工作能经得起实践和历史的检验；二要敬畏百姓，让自己做的事情对得起养育我们的人民；三要敬畏人生，将来回首往事的时候不会感到后悔。,340471,
民进党称14日前约陈水扁说明海外账户事件,340472,
中新网9月6日电 据“中央社”报道，陈水扁被控海外洗钱疑案，民进党中央党部廉政委员会主任委员张天钦今天表示，预计九月十四日前约询陈水扁说明海外设立账户一事，九月十一日将开会讨论民进党台北市党部移送前“第一家庭”成员吴淑珍、陈致中、黄睿靓三人停权案的后续处理事宜。,340472," (47,台北市)"
胡锦涛会见伊朗总统内贾德(图),340473,
中新网北京九月六日电 (记者 孙宇挺) 中国国家主席胡锦涛六日在北京会见了伊朗总统艾哈迈迪-内贾德。,340473,
胡锦涛会见伊朗总统内贾德,340474,
新华网北京9月6日电 (记者钱彤、李诗佳)国家主席胡锦涛6日在人民大会堂会见前来出席北京残奥会开幕式的伊朗总统内贾德。,340474,
胡锦涛会见出席北京残奥会开幕式的内贾德,340475," (3,北京)"
中广网北京9月6日消息 (记者赵雪花) 国家主席胡锦涛今天(6日)下午1点30分在人民大会堂会见了前来出席北京残奥会开幕式的伊朗总统内贾德。,340475,
胡锦涛设宴欢迎出席北京残奥会贵宾,340476,
我国将出台规定加强短信广告服务管理,340477,
新华网北京9月7日电 (记者刘菊花)针对手机垃圾短信息广告扰民问题，中国工业和信息化部、国家工商行政管理总局将出台并组织实施“现阶段加强短信息广告服务管理的规定”。,340477,
斯洛伐克10米气步枪选手夺冠成残奥会首金,340478,
中新网9月7日电 在刚刚结束的北京残奥会R2女子10米气步枪立射-SH1决赛中，斯洛伐克选手韦罗妮卡・瓦多维乔娃以494.8环的总成绩摘得北京残奥会首枚金牌。,340478,
本月两岸周末包机将达144架次,340479,
本报讯（通讯员 木忠诚 记者 江跃中）随着两岸周末包机的逐渐成熟，包机的数量和密度都在不断增加。记者昨天从浦东边检站获悉，由于今年中秋节9月14日恰逢星期日，两岸中秋包机将直接纳入两岸周末包机体系，9月份两岸周末包机总数将达到144架次。,340479,
残奥会开赛首日中国军团收获13枚奖牌3枚金牌,340480,
中新社北京九月七日电 (记者 王祖敏)北京残奥会开赛首日，中国代表团以三枚金牌数暂列金牌榜第三位，但其十三枚奖牌却高居奖牌榜首位。,340480,
温家宝会见韩国总理韩升洙(图),340481,
中广网北京9月7日消息 国务院总理温家宝今天9月7日在中南海紫光阁会见来华出席北京残奥会开幕式的韩国总理韩升洙。,340481,
萨摩亚独立国成为我国公民自费旅游目的国,340482,
新华网北京9月7日电 (记者钱春弦)国家旅游局局长邵琪伟7日与萨摩亚独立国副总理米萨・特莱福尼・雷茨拉夫签署了《关于中国旅游团队赴萨摩亚独立国旅游实施方案的谅解备忘录》，这标志着萨摩亚成为中国公民自费旅游目的国。,340482,
香港举行第四届立法会选举 曾荫权呼吁踊跃投票,340483," (0,香港)"
中新社香港九月七日电 (记者 晓萍) 香港特区第四届立法会选举今日在此间举行。特区行政长官曾荫权和夫人曾鲍笑薇上午到港岛半山罗便臣道一个投票站投票，并呼吁选民踊跃投票，选出心目中的理想代表，共同建设经济蓬勃及和谐的香港。,340483," (1,香港)"
中编办：个别部委领导超员属过渡情况,340484,
对于一些国务院下辖部委在领导职数上超员的问题，中央机构编制委员会办公室(下称“中编办”)相关负责人日前表示，对个别因机构整合等原因超职数配备的，允许作为特殊情况在一定时间内过渡。,340484,
习近平会见北京残奥会美国总统代表团团长,340485,
中新社北京九月八日电 (记者 张朔)中国国家副主席习近平八日在北京钓鱼台国宾馆会见美国总统代表团团长、退伍军人事务部长皮克。习近平表示，双方应把一个健康稳定和更富活力的中美关系带向未来。,340485,
传台当局首度制定整体战略 两岸和解为一大主轴,340486,
中新网9月8日电 据台湾《联合报》报道，消息人士透露，台当局“国安会”正秘密研拟整体战略，把确保台湾生存发展的基本原则形诸文字。这是台当局首度制定这一战略，内容包含台湾、两岸与国际等方面，这份战略将指导台湾未来十数年的走向。,340486," (5,台湾)"
刑法修正案解读：工作人员配偶子女受贿可定罪,340487,
社会生活中常有这样的现象，有些国家工作人员的配偶、子女等近亲属以及其他与该国家工作人员关系密切的人，通过该国家工作人员职务上的便利，索取或者收受财物。此外，一些已离职的国家工作人员，通过其他国家工作人员的职务行为为请托人谋取不正当利益，自己从中索取或者收受财物。刑法修正案(七)草案提出以上行为可定罪。,340487,
商务部长：中国明年将成亚洲最大消费市场,340488," (3,中国) (7,亚洲)"
新华网厦门9月8日电 (记者来建强)8日，中国商务部部长陈德铭在此间举行的中日投资促进机构第15次联席会上透露，到2009年，中国将成为亚洲最大的消费市场，文化娱乐、住宅、旅游等占国内消费的比重将越来越大。,340488,
外交部就核供应国解除对印核出口限制答问,340489,
